<?xml version="1.0" encoding="UTF-8"?>
<!DOCTYPE juego SYSTEM "the.dtd">

<juego nombre="collblanc" dificultad="baja">
  <personaje alien="no">
    <nombre>pswsm</nombre>
    <vidas>∞</vidas>
    <armas>FGC-9</armas>
    <armas>Vector .45 ACP</armas>
    <armas>D-50</armas>
    <herramientas>godmode</herramientas>
    <superpoder/>
    <superpoder/>
  </personaje>
  <personaje alien="no">
    <nombre>not me</nombre>
    <vidas>1</vidas>
    <herramientas>múscul</herramientas>
  </personaje>
  <escenario>
    <pais>Catalunya</pais>
    <nombre_lugar>L'Hospitalet de Llobregat</nombre_lugar>
    <coordenadas>
      <x>41</x>
      <y>35</y>
      <z>67+</z>
    </coordenadas>
  </escenario>
  <musica>
    <nombre_cancion>PDA</nombre_cancion>
    <genero>Trap Catala</genero>
  </musica>
</juego>
